id,citation,year,tier,url_or_file,notes
kawasaki-2026-comparison,"Kawasaki Heavy Industries, Ltd. Comparison between LH2 and other Carriers of Hydrogen.",2026,proprietary,sources/raw/Project/Kawasaki Heavy Industries/Comparison_btw_LH2_and_other_carriers_KHI2604_R1.md,"KHI2604 R1, Apr 2026. Qualitative carrier comparison (LH2/NH3/MCH): energy-efficiency deltas, CO2 emissions, ammonia-as-fuel constraints. Energy/CO2 deltas trace to IEA GHR 2022 / IEA Apr-2023."
kawasaki-2026-supplemental,"Kawasaki Heavy Industries, Ltd. Supplemental Information — Comparison between LH2 and other Carriers of Hydrogen.",2026,proprietary,sources/raw/Project/Kawasaki Heavy Industries/Supplemental_Information_Comparison_btw_LH2_and_other_carriers_KHI2605_R0.md,"KHI2605 R0, May 2026. Per-component cost stacks + chain specs for LH2/MCH/NH3 at Base (2.5B Nm3/y) & Large (10B Nm3/y); liquefier 0.55 kWh/Nm3, vessel 160000 m3 @ 29.6 km/h, BOR 0.1%/d. Cost figures trace to iae-2019-gigaton."
kawasaki-2026-questionnaire,"Kawasaki Heavy Industries, Ltd. Gentari Liquid H2 Questionnaire — KHI reply (Rev.1).",2026,proprietary,sources/raw/Project/Kawasaki Heavy Industries/KHI_Gentari_Liquid_H2_Questionnaire_20260220_KHI_reply0331_GHSB20260406.md,"Mar 31 / Apr 6 2026. Liquefaction SEC ~8-9 kWh/kg; min scale ~10000 tpa; H2 Claude + N2 precool; Fe-based O-P catalyst; regas duty ~3.8 MJ/kg-LH2; BOG-as-fuel = BOR; no onboard reliquefaction; claims no H2 losses. Supersedes reply0304."
kawasaki-2026-questionnaire-r0,"Kawasaki Heavy Industries, Ltd. Gentari Liquid H2 Questionnaire — KHI reply (Mar 4).",2026,proprietary,sources/raw/Project/Kawasaki Heavy Industries/KHI_Gentari_Liquid_H2_Questionnaire_20260220_KHI_reply0304.md,"Mar 4 2026. Earlier revision of the questionnaire; superseded by kawasaki-2026-questionnaire. Retained for traceability."
kawasaki-hydrogen-activities,"Kawasaki Heavy Industries, Ltd. Kawasaki's Hydrogen Activities.",2026,proprietary,sources/raw/Project/Kawasaki Heavy Industries/Kawasakis_Hydrogen_Activities_2.md,"Company overview of KHI hydrogen value-chain activities (Suiso Frontier, liquefaction, carriers, terminals). Publication date to confirm [needs date]."
iae-2019-gigaton,"Institute of Applied Energy (IAE). Gigaton Workshop, WHTC 2019 (6 May 2019).",2019,institutional,sources/raw/Project/Kawasaki Heavy Industries/Supplemental_Information_Comparison_btw_LH2_and_other_carriers_KHI2605_R0.md,"Origin of the LH2/MCH/NH3 per-component carrier-cost comparison reproduced in kawasaki-2026-supplemental. Cited second-hand via KHI; primary IAE source not yet held in repo [needs source: primary]."
